页码,评论内容
1,审美在线
1,省吃俭用的领克08车主
1,非常不错的一款车，外观颜值很高
1,外观设计大气，内饰搭配简洁大方
1,照片拍的不错，总结的很好！
1,第一张图片拍的太有感觉了，看上去整个车特别高端
1,这照片配上这夜景实在太有感觉了
1,领克这个车还是非常不错的，车子动感，动力也强
1,颜值是正义
1,这个车真漂亮啊
1,电车还是很省钱的
1,非常帅的车呢
1,这车停哪儿都是焦点
1,好车，也看看我的吧
1,这个车外观非常大气，空间非常漂亮，主要是质感，给人感觉很扎实的感觉！
1,此帖必火
1,来看看我的，同款
1,这车真板正啊🚖
1,这谁能顶得住啊🤩
1,来了车友
2,太帅了哥们
2,仪式感不能少
2,08真的非常帅，颜值担当，操控好，互赞+好评一下，友友，谢谢
2,这辆车不是在“炫技术”，而是在慢慢改变我的生活节奏。尤其是进入 2026 年，我反而更想把这些看似普通、但真实有效的日常记录下来。
2,车型配置，包括空间，这个级别当中都是比较有优势的存在。
2,领克08这款车不错可以没问题，有机会的话试驾一下。
2,这款车的外形设计中规中矩，然后内饰配置的话比较丰富，智驾让出行更方便更安顺
2,省心
2,不错不错，看我01
2,08这么帅
2,电费省下来去干嘛呢
2,这个车外观非常大气，空间非常漂亮，主要是质感，给人感觉很扎实的感觉！这款车的外形设计中规中矩，然后内饰配置的话比较丰富，智驾让出行更方便更安顺
2,时尚大气，空间宽敞，动力强劲，座椅舒适，续航持久
2,好车，欢迎互动
2,支持一下
2,第一张图片拍的太有感觉了，看上去整个车特别高端
2,在慢慢改变我的生活节奏。尤其是进入 2026 年，我反而更想把这些看似普通
2,这个费用在电车里面，不知道怎么样，反正我的油车是两块钱1公里
2,好看
2,起步轻快、转向好控制，城市里走走停停不会累，高速上也很稳，不会有那种“虚”的感觉。
3,感谢分享，生活不止眼前的苟且，还有诗和一个不知道的未来，经典好车，不错，值得购买。
3,这个车看起来外观年轻时尚，而且有智驾系统的加持，安全性更高，很不想
3,领克这个车外观非常大气，空间非常漂亮，主要是质感，给人感觉很扎实的感觉！
3,这款车外观设计漂亮颜值很高值得拥有一个这个车外观非常大气，空间非常漂亮，主要是质感，给人感觉很扎实的感觉！这款车的外形设计中规中矩，然后内饰配置的话比较丰富，智驾让出行更方便更安顺
3,日常使用毫无卡顿感。其外观设计简约大气，质感十足，握持手感舒适。续航能力出色
3,起步轻快、转向好控制，城市里走走停停不会累，高速上也很稳，不会有那种“虚”的感觉。你会发现，它的存在感刚刚好——不打扰你，但一直在兜底。
3,领克汽车特别好，特别棒，加油，，你是最棒的， 相信自己，一定能行。
3,充电习惯真的能改变用车成本，也能改变生活状态。
3,空间广泛深入同意XCVB***姐给的现场V家kkj
3,08 已经成了我每天生活的一部分。通勤、买菜、周末短途出游，它都不需要我“特别对待”。起步轻快、转向好控制，城市里走走停停不会累，高速上也很稳，不会有那种“虚”的感觉。
3,确实很不错的车子，空间和性价比都可以，值得拥有
3,领克08这个车子的外观设计风格和功能配置都是不错的！
3,领克08这个车子的外观设计风格和功能配置都是不错的！
3,人生在世，最惬意的事莫过于读万卷书，行万里路，去不同的地方，遇见不同的人，结识一群志同道合的朋友，展开一段平淡又让人回味的故事。唷，起风了。愿我们乘风归去，归来依旧是少年。起风了听了一遍又一遍 无数次想回到让我感受到爱意的那个夏天 我没难过可我一直发呆感觉心里空空的。我们都在听起风了，也都在回忆自己希望我们不是用一生去治愈过去的伤痛毕竟过去的那个世界回不去了只愿这未来我们会有重现辉煌与精彩的一天即使否然，也希望你一定要做一个快乐的人
3,运动时尚显年轻，科技感强的产品，好车值得拥有
3,这款车的外形设计中规中矩，然后内饰配置的话比较丰富，智驾让出行更方便更安顺这个车外观非常大气，空间非常漂亮，主要是质感，给人感觉很扎实的感觉！这款车的外形设计中规中矩，然后内饰配置的话比较丰富，智驾让出行更方便更安顺
3,你看被告这吉利的技术也有着沃尔沃的愈合之后，技术的加持，特别是新能源的豪华感
3,领克08的外观颜值高，能耗表现令人满意，适合家用的一款车
3,质感很好，内饰很漂亮，主要空间也很够用这款车不错
3,领克08真的超级好看，外观是真的好看，真的比例特别好
4,内部配置丰富搭配清新脱俗！这汽车威武霸气侧漏，特别好，
4,起步轻快、转向好控制，城市里走走停停不会累，高速上也很稳，不会有那种“虚”的感觉。的确不错！
4,领克08还是很帅的，外观设计时尚大气，非常有质感，操控性也不错。
4,不错不错
4,他这个车子还是挺好的，品质不错，而且科技化程度，还有说操控感都挺好的。
4,这车还是蛮不错的，性价比很高，而且外观也比较时尚。嗯，空间也大家用挺好的。
4,大片再现，真不错！骑着爱车，走遍祖国大好河山，尝尽各方美味，体验各方习俗，甚好甚好！
4,好车好心情，愉悦一整天，快乐驾驶。
4,感谢相遇，未来可期！
4,
4,外观漂亮大气。这车第一眼个人比较喜欢，外观确实看着大气上档次，内饰豪华，动力十足。非要说不足，就是价格再优惠些更好啦。
4,插混确实解决了油耗和续航的平衡问题 08做工还是很扎实的
4,第一张图片拍的太有感觉了，看上去整个车特别高端！
4,08的电话可能和幺零的差不多，应该还是能达到21个左右吧。车子是一台不错的车。品控还是不错的。
4,反而更想把这些看似普通、但真实有效的日常记录
4,哇塞
4,的确是这样的，这样能耗最低了，通勤价格也会很低了，很不错的通勤表现
4,确实不错，外观时尚前卫颜值担当，内饰奢华配置丰富，驾乘舒适，值得拥有。
4,轻快、转向好控制，城市里走走停停不会累，高速上也很稳，不会有那种“虚”的感觉。你会发现，它的存在感刚刚好——不打扰你，但一直在兜底
4,转向灵活，窄停车场也轻松停稳，还是挺好开的
5,抬头显示很清晰。节俭而不抠门，不慷他人之慨，随心而行，很好的生活态度，有情绪价值，不为情绪所扰，保持这种姿态！
5,帅，互互
5,非常实用，收藏了！👍️
5,什么颜色呀
5,好帅啊
5,车友们，互一下[ahl_耶]
5,一个混动车天天大早晨去外面充电，这不***吗
5,与汽车同行，与世界分享！
5,妙啊👍️
5,省吃俭用具像化
5,写的真好
5,啥也不说了 鼓掌👏
5,又是一辆这个颜色的。严重怀疑这个颜色的涂料成本最低，所以厂家主推这个颜色。我买的时候店里说这个提车最快
